topic,title,section,text,raw_document,cleaned_document
travel,Form I-515A Overview,"If CBP gave me a Form I-515A and I paid the I-901 SEVIS Fee, do I still need to send the documents to SEVP?","Yes. If you made an I-901 SEVIS Fee payment, it is important to make sure the I-901 SEVIS Fee payment made is for your current SEVIS ID number found on the top of the Form I-20 you last used to enter the United States. If you received a Form I-515A for failure to pay the I-901 SEVIS Fee, you must: Pay the I-901 SEVIS Fee . Work with your DSO to provide the proper documentation to SEVP in order to extend your nonimmigrant student status. Work with your DSO to submit the required documents to SEVP and include a copy of the passport stamp in the documents you submit. SEVP will let you and your DSO know what further action, if any, is required of you.","Form I-515A Overview
If CBP gave me a Form I-515A and I paid the I-901 SEVIS Fee, do I still need to send the documents to SEVP?
Yes. If you made an I-901 SEVIS Fee payment, it is important to make sure the I-901 SEVIS Fee payment made is for your current SEVIS ID number found on the top of the Form I-20 you last used to enter the United States. If you received a Form I-515A for failure to pay the I-901 SEVIS Fee, you must: Pay the I-901 SEVIS Fee . Work with your DSO to provide the proper documentation to SEVP in order to extend your nonimmigrant student status. Work with your DSO to submit the required documents to SEVP and include a copy of the passport stamp in the documents you submit. SEVP will let you and your DSO know what further action, if any, is required of you.",form i-515a overview cbp gave form i-515a paid i-901 sevis fee still need send documents sevp yes made i-901 sevis fee payment important make sure i-901 sevis fee payment made current sevis id number found top form i-20 last used enter united states received form i-515a failure pay i-901 sevis fee must pay i-901 sevis fee work dso provide proper documentation sevp order extend nonimmigrant student status work dso submit required documents sevp include copy passport stamp documents submit sevp let dso know action required
travel,Form I-515A Overview,"If I received a Form I-515A before April 1, 2016, will the termination procedure still apply?","Yes. The Form I-515A Noncompliance Termination Procedure will apply to any student, dependent or exchange visitor who has received a Form I-515A during their stay in the United States and who has not departed or responded within the 30-day compliance period. This means that if a student received a Form I-515A prior to April 1, 2016, but has yet to properly respond to SEVP, they will receive an “Intent to Terminate” letter. How do I know if I have properly complied with the Form I-515A? If you follow all of the proper steps and submit your corrected documents to SEVP within the 30-day compliance window, SEVP will notify your DSO once it has adjudicated the documents and granted you permission to stay in the United States for “duration of status.” When responding to a Form I-515A, students and exchange visitors must include the following documentation to SEVP: Form I-515A. Form I-20 or DS-2019, with signatures. Form I-94, “Arrival/Departure Record,” with the identification number or a print-out from the paperless Form I-94 system. Copy of the admission stamp in your passport. I-901 SEVIS Fee receipt for the SEVIS ID used to enter the country. Once SEVP completes its adjudication, it will return the original Form I-20 or DS-2019 along with the other documentation to the school or program with a letter indicating compliance. Students and exchange visitors should follow up directly with their school or program sponsor to verify that their SEVIS record is not at risk for termination. If you are interested in applying for reinstatement with USCIS, please visit its website for more information about the applicable fees and process.","Form I-515A Overview
If I received a Form I-515A before April 1, 2016, will the termination procedure still apply?
Yes. The Form I-515A Noncompliance Termination Procedure will apply to any student, dependent or exchange visitor who has received a Form I-515A during their stay in the United States and who has not departed or responded within the 30-day compliance period. This means that if a student received a Form I-515A prior to April 1, 2016, but has yet to properly respond to SEVP, they will receive an “Intent to Terminate” letter. How do I know if I have properly complied with the Form I-515A? If you follow all of the proper steps and submit your corrected documents to SEVP within the 30-day compliance window, SEVP will notify your DSO once it has adjudicated the documents and granted you permission to stay in the United States for “duration of status.” When responding to a Form I-515A, students and exchange visitors must include the following documentation to SEVP: Form I-515A. Form I-20 or DS-2019, with signatures. Form I-94, “Arrival/Departure Record,” with the identification number or a print-out from the paperless Form I-94 system. Copy of the admission stamp in your passport. I-901 SEVIS Fee receipt for the SEVIS ID used to enter the country. Once SEVP completes its adjudication, it will return the original Form I-20 or DS-2019 along with the other documentation to the school or program with a letter indicating compliance. Students and exchange visitors should follow up directly with their school or program sponsor to verify that their SEVIS record is not at risk for termination. If you are interested in applying for reinstatement with USCIS, please visit its website for more information about the applicable fees and process.",form i-515a overview received form i-515a april 1 2016 termination procedure still apply yes form i-515a noncompliance termination procedure apply student dependent exchange visitor received form i-515a stay united states departed responded within 30-day compliance period means student received form i-515a prior april 1 2016 yet properly respond sevp receive intent terminate letter know properly complied form i-515a follow proper steps submit corrected documents sevp within 30-day compliance window sevp notify dso adjudicated documents granted permission stay united states duration status responding form i-515a students exchange visitors must include following documentation sevp form i-515a form i-20 ds-2019 signatures form i-94 arrival departure record identification number print-out paperless form i-94 system copy admission stamp passport i-901 sevis fee receipt sevis id used enter country sevp completes adjudication return original form i-20 ds-2019 along documentation school program letter indicating compliance students exchange visitors follow directly school program sponsor verify sevis record risk termination interested applying reinstatement uscis please visit website information applicable fees process
travel,Form I-515A Overview,Will I still need to send in all the required documents to SEVP to resolve the Form I-515A even though I visited a Deferred Inspection station?,"No, but you will need to notify your DSO and SEVP of the deferred inspection station that you visited, the CBP officer’s name who worked with you and the date when you corrected the deficiency in documentation. You also need to send SEVP a receipt or proof of visiting the deferred inspection station if you received it from CBP.","Form I-515A Overview
Will I still need to send in all the required documents to SEVP to resolve the Form I-515A even though I visited a Deferred Inspection station?
No, but you will need to notify your DSO and SEVP of the deferred inspection station that you visited, the CBP officer’s name who worked with you and the date when you corrected the deficiency in documentation. You also need to send SEVP a receipt or proof of visiting the deferred inspection station if you received it from CBP.",form i-515a overview still need send required documents sevp resolve form i-515a even though visited deferred inspection station need notify dso sevp deferred inspection station visited cbp officer s name worked date corrected deficiency documentation also need send sevp receipt proof visiting deferred inspection station received cbp
travel,Form I-515A Overview,"If SEVP notified my DSO that I received a Form I-515A but I did not receive one, do I still need to respond to SEVP’s request for documents?","Yes. If you or your DSO do not respond to SEVP, it could negatively impact your nonimmigrant student status . Make sure that you or your DSO informs SEVP that you did not receive a Form I-515A. SEVP will let you and your DSO know what, if any, further action is required of you.","Form I-515A Overview
If SEVP notified my DSO that I received a Form I-515A but I did not receive one, do I still need to respond to SEVP’s request for documents?
Yes. If you or your DSO do not respond to SEVP, it could negatively impact your nonimmigrant student status . Make sure that you or your DSO informs SEVP that you did not receive a Form I-515A. SEVP will let you and your DSO know what, if any, further action is required of you.",form i-515a overview sevp notified dso received form i-515a receive one still need respond sevp s request documents yes dso respond sevp could negatively impact nonimmigrant student status make sure dso informs sevp receive form i-515a sevp let dso know action required
travel,Form I-515A Overview,"If I forgot my Form I-20 or DS-2019 and received a Form I-515A for this reason, can I present the Form I-20 to a CBP Deferred Inspection station within the 30 days?","Yes; however, SEVP recommends you ask for and retain a receipt or proof of taking this action at the Deferred Inspection location.","Form I-515A Overview
If I forgot my Form I-20 or DS-2019 and received a Form I-515A for this reason, can I present the Form I-20 to a CBP Deferred Inspection station within the 30 days?
Yes; however, SEVP recommends you ask for and retain a receipt or proof of taking this action at the Deferred Inspection location.",form i-515a overview forgot form i-20 ds-2019 received form i-515a reason present form i-20 cbp deferred inspection station within 30 days yes however sevp recommends ask retain receipt proof taking action deferred inspection location
travel,Form I-515A Overview,What should I do to avoid receiving a Form I-515A and help have a smooth entry or re-entry into the United States?,"To avoid receiving a Form I-515A, you should hand-carry the following paperwork with you when you arrive at the U.S. port of entry. Do not put them in your checked baggage as you will not receive your baggage until you are admitted into the United States. You should hand-carry: A valid passport. A signed Form I-20 or Form DS-2019. Evidence of financial support. You also should hand-carry (not put in checked baggage) the following documentation, if applicable: Paper receipt for payment of your I-901 SEVIS Fee . Name and contact information for your DSO, including a 24-hour emergency contact telephone number at the school. Make sure all this paperwork is up-to-date, accurate and signed, as necessary.","Form I-515A Overview
What should I do to avoid receiving a Form I-515A and help have a smooth entry or re-entry into the United States?
To avoid receiving a Form I-515A, you should hand-carry the following paperwork with you when you arrive at the U.S. port of entry. Do not put them in your checked baggage as you will not receive your baggage until you are admitted into the United States. You should hand-carry: A valid passport. A signed Form I-20 or Form DS-2019. Evidence of financial support. You also should hand-carry (not put in checked baggage) the following documentation, if applicable: Paper receipt for payment of your I-901 SEVIS Fee . Name and contact information for your DSO, including a 24-hour emergency contact telephone number at the school. Make sure all this paperwork is up-to-date, accurate and signed, as necessary.",form i-515a overview avoid receiving form i-515a help smooth entry re-entry united states avoid receiving form i-515a hand-carry following paperwork arrive u s port entry put checked baggage receive baggage admitted united states hand-carry valid passport signed form i-20 form ds-2019 evidence financial support also hand-carry put checked baggage following documentation applicable paper receipt payment i-901 sevis fee name contact information dso including 24-hour emergency contact telephone number school make sure paperwork up-to-date accurate signed necessary
study,Full Course of Study,,"To maintain your status as an F-1 or M-1 student in the United States, you must enroll in a full course of study at the Student and Exchange Visitor Program (SEVP)-certified school where a designated school official (DSO) issued you the Form I-20, “Certificate of Eligibility for Nonimmigrant Student Status,” you used to enter into the United States. The definition of a full course of study varies depending on both your status (F-1 or M-1) and the program of study you attend. For instance, U.S. government regulations define a full course of study at an SEVP-certified kindergarten to grade 12 school differently than at an SEVP-certified college or university. To help better understand the definition of a full course of study, below is a breakdown according to status and program of study.","Full Course of Study
To maintain your status as an F-1 or M-1 student in the United States, you must enroll in a full course of study at the Student and Exchange Visitor Program (SEVP)-certified school where a designated school official (DSO) issued you the Form I-20, “Certificate of Eligibility for Nonimmigrant Student Status,” you used to enter into the United States. The definition of a full course of study varies depending on both your status (F-1 or M-1) and the program of study you attend. For instance, U.S. government regulations define a full course of study at an SEVP-certified kindergarten to grade 12 school differently than at an SEVP-certified college or university. To help better understand the definition of a full course of study, below is a breakdown according to status and program of study.",full course study maintain status f-1 m-1 student united states must enroll full course study student exchange visitor program sevp -certified school designated school official dso issued form i-20 certificate eligibility nonimmigrant student status used enter united states definition full course study varies depending status f-1 m-1 program study attend instance u s government regulations define full course study sevp-certified kindergarten grade 12 school differently sevp-certified college university help better understand definition full course study breakdown according status program study
study,Full course of study requirements for F-1 and M-1 students at K-12 schools,,"F-1 students at a private academic school or public academic high school (grades 9-12) must meet the minimum number of hours per week their school determines is necessary for normal progress toward graduation or completion of the program of study. M-1 students at a vocational or other non-academic high school must meet the minimum number of hours per week that their school determines is necessary for normal progress toward graduation or completion of the program of study. If you are an F-1 or M-1 student at a K-12 school and do not know how many hours per week fulfill your school’s requirement for normal progress toward graduation or completion of the program of study, talk to your DSO . Your DSO will know how many hours of class you need to attend each week and can tell you if your class schedule meets the requirement.","Full course of study requirements for F-1 and M-1 students at K-12 schools
F-1 students at a private academic school or public academic high school (grades 9-12) must meet the minimum number of hours per week their school determines is necessary for normal progress toward graduation or completion of the program of study. M-1 students at a vocational or other non-academic high school must meet the minimum number of hours per week that their school determines is necessary for normal progress toward graduation or completion of the program of study. If you are an F-1 or M-1 student at a K-12 school and do not know how many hours per week fulfill your school’s requirement for normal progress toward graduation or completion of the program of study, talk to your DSO . Your DSO will know how many hours of class you need to attend each week and can tell you if your class schedule meets the requirement.",full course study requirements f-1 m-1 students k-12 schools f-1 students private academic school public academic high school grades 9-12 must meet minimum number hours per week school determines necessary normal progress toward graduation completion program study m-1 students vocational non-academic high school must meet minimum number hours per week school determines necessary normal progress toward graduation completion program study f-1 m-1 student k-12 school know many hours per week fulfill school s requirement normal progress toward graduation completion program study talk dso dso know many hours class need attend week tell class schedule meets requirement
study,Full course of study requirements for post-secondary programs,F-1 post-secondary requirements,"F-1 post-secondary students have a number of requirements they must abide by to remain compliant. F-1 undergraduate students at a college or university must take at least 12 credit hours per term. F-1 students in postgraduate programs at a college, university, conservatory or seminary must take a full course of study as certified by the institution. F-1 students in other post-secondary liberal arts, fine arts or other non-vocational or English language learning training programs must meet 18 clock hours per week if the majority is classroom instruction or 22 clock hours per week if the majority of the program instruction does not take place in the classroom, such as laboratory work. Online courses cannot count toward a full course of study for an English language training student. If you are an F-1 student in a post-secondary program of study and are unsure if your class schedule meets the requirements for a full course of study, talk to your DSO. Your DSO can verify that your class schedule for this academic term meets the requirements to maintain your status. If meeting this full course load requirement is difficult for you, talk to your DSO immediately to discuss if you are eligible for a reduced course load. For more information, please read the “Reduced Course Load” and “Reduced Course Load for Language Limitations” sections below.","Full course of study requirements for post-secondary programs
F-1 post-secondary requirements
F-1 post-secondary students have a number of requirements they must abide by to remain compliant. F-1 undergraduate students at a college or university must take at least 12 credit hours per term. F-1 students in postgraduate programs at a college, university, conservatory or seminary must take a full course of study as certified by the institution. F-1 students in other post-secondary liberal arts, fine arts or other non-vocational or English language learning training programs must meet 18 clock hours per week if the majority is classroom instruction or 22 clock hours per week if the majority of the program instruction does not take place in the classroom, such as laboratory work. Online courses cannot count toward a full course of study for an English language training student. If you are an F-1 student in a post-secondary program of study and are unsure if your class schedule meets the requirements for a full course of study, talk to your DSO. Your DSO can verify that your class schedule for this academic term meets the requirements to maintain your status. If meeting this full course load requirement is difficult for you, talk to your DSO immediately to discuss if you are eligible for a reduced course load. For more information, please read the “Reduced Course Load” and “Reduced Course Load for Language Limitations” sections below.",full course study requirements post-secondary programs f-1 post-secondary requirements f-1 post-secondary students number requirements must abide remain compliant f-1 undergraduate students college university must take least 12 credit hours per term f-1 students postgraduate programs college university conservatory seminary must take full course study certified institution f-1 students post-secondary liberal arts fine arts non-vocational english language learning training programs must meet 18 clock hours per week majority classroom instruction 22 clock hours per week majority program instruction take place classroom laboratory work online courses cannot count toward full course study english language training student f-1 student post-secondary program study unsure class schedule meets requirements full course study talk dso dso verify class schedule academic term meets requirements maintain status meeting full course load requirement difficult talk dso immediately discuss eligible reduced course load information please read reduced course load reduced course load language limitations sections
study,Full course of study requirements for post-secondary programs,M-1 post-secondary requirements,"M-1 post-secondary students have a number of requirements they must abide by to remain compliant. M-1 students at a community college or junior college must take at least 12 credit hours per term. M-1 students at certain post-secondary vocational or business schools must take at least 12 hours of instruction per week. M-1 students in vocational or other non-academic curricular programs must take 18 clock hours per week if the majority is classroom instruction or 22 clock hours per week if the majority of the program instruction does not take place in the classroom, such as laboratory work or flight training. If you are an M-1 student in a post-secondary program of study and are unsure if your schedule meets the requirements for a full course of study, talk to your DSO to verify your schedule meets the requirements to maintain your status. If meeting this full course load requirement is difficult for you because of medical reasons, talk to your DSO immediately to discuss if you are eligible for a reduced course load.","Full course of study requirements for post-secondary programs
M-1 post-secondary requirements
M-1 post-secondary students have a number of requirements they must abide by to remain compliant. M-1 students at a community college or junior college must take at least 12 credit hours per term. M-1 students at certain post-secondary vocational or business schools must take at least 12 hours of instruction per week. M-1 students in vocational or other non-academic curricular programs must take 18 clock hours per week if the majority is classroom instruction or 22 clock hours per week if the majority of the program instruction does not take place in the classroom, such as laboratory work or flight training. If you are an M-1 student in a post-secondary program of study and are unsure if your schedule meets the requirements for a full course of study, talk to your DSO to verify your schedule meets the requirements to maintain your status. If meeting this full course load requirement is difficult for you because of medical reasons, talk to your DSO immediately to discuss if you are eligible for a reduced course load.",full course study requirements post-secondary programs m-1 post-secondary requirements m-1 post-secondary students number requirements must abide remain compliant m-1 students community college junior college must take least 12 credit hours per term m-1 students certain post-secondary vocational business schools must take least 12 hours instruction per week m-1 students vocational non-academic curricular programs must take 18 clock hours per week majority classroom instruction 22 clock hours per week majority program instruction take place classroom laboratory work flight training m-1 student post-secondary program study unsure schedule meets requirements full course study talk dso verify schedule meets requirements maintain status meeting full course load requirement difficult medical reasons talk dso immediately discuss eligible reduced course load
