topic,title,section,text,raw_document,cleaned_document
prepare,Student Forms,Forms While You Are in the United States,"Form I-94, ""Arrival/Departure Record"" The Form I-94, “Arrival/Departure Record,” is a Department of Homeland Security (DHS) document issued to nonimmigrant aliens at the time of lawful entry into the United States at an air or sea port of entry. The Form I-94 is evidence of a nonimmigrant’s term of admission and used to document legal status in the United States, including length of stay and departure. On March 27, 2013, U.S. Customs and Border Protection (CBP) published an interim final rule, Definition of Form I-94 To Include Electronic Format in the Federal Register to automate the Form I-94 . With the new automated Form I-94 process, the CBP officer will create an electronic automated arrival Form I-94 during the admissions process for nonimmigrants entering the United States at an air or sea port, with information already available in various law enforcement databases. The new Form I-94 automation process will take effect on April 30, 2013, and will streamline the admissions process for individuals lawfully visiting the United States through an air and sea port. For more information regarding the Form I-94 automation, please review the resources below: I-94 Admission Number Retrieval Stakeholder Webinar: Form I-94 Automation Form I-94 Fact Sheet Form I-94 Quick Reference Guide Find more information on our Viewers and Players page Form I-515A, “Notice to Student or Exchange Visitor” If you arrive at a U.S. port of entry without the required documents, a Customs and Border Protection officer may issue you this form. It allows you temporary admittance to the United States for 30 days. During that time you must send the required documents to the Student and Exchange Visitor Program (SEVP) Form I-515A processing team or depart the United States. To learn more, visit Form I-515A Overview This is very important: If you do not send the required documents to the SEVP Form I-515A processing team within 30 days, your nonimmigrant status will be terminated, and you must leave the United States immediately. Form I-539, “Application to Extend/Change Nonimmigrant Status” Use this form if you want to request a change to another nonimmigrant visa status (F-2 to F-1, F-1 to H-1B, etc.), or to request reinstatement if you have fallen out of student status. M students must also use this form to extend nonimmigrant status or transfer to another Student and Exchange Visitor Program-certified school. You can complete this form on the I-539, Application To Extend/Change Nonimmigrant Status page of the U.S. Citizenship and Immigration Services website. For more information about applications to extend or change nonimmigrant status, please visit the Change of Status resource page . To access a link to the online form and online filing eligibility, visit the Form I-539 Online page . Form I-765, “Application for Employment Authorization” Submit this form with U.S. Citizenship and Immigration Services (USCIS) to apply for employment authorization, such as optional practical training or off-campus employment. You can complete this form on the I-765, Application for Employment Authorization page of the USCIS website. For more information about instances when you may need to apply for employment authorization, visit the Training Opportunities in the United States resource page.","Student Forms
Forms While You Are in the United States
Form I-94, ""Arrival/Departure Record"" The Form I-94, “Arrival/Departure Record,” is a Department of Homeland Security (DHS) document issued to nonimmigrant aliens at the time of lawful entry into the United States at an air or sea port of entry. The Form I-94 is evidence of a nonimmigrant’s term of admission and used to document legal status in the United States, including length of stay and departure. On March 27, 2013, U.S. Customs and Border Protection (CBP) published an interim final rule, Definition of Form I-94 To Include Electronic Format in the Federal Register to automate the Form I-94 . With the new automated Form I-94 process, the CBP officer will create an electronic automated arrival Form I-94 during the admissions process for nonimmigrants entering the United States at an air or sea port, with information already available in various law enforcement databases. The new Form I-94 automation process will take effect on April 30, 2013, and will streamline the admissions process for individuals lawfully visiting the United States through an air and sea port. For more information regarding the Form I-94 automation, please review the resources below: I-94 Admission Number Retrieval Stakeholder Webinar: Form I-94 Automation Form I-94 Fact Sheet Form I-94 Quick Reference Guide Find more information on our Viewers and Players page Form I-515A, “Notice to Student or Exchange Visitor” If you arrive at a U.S. port of entry without the required documents, a Customs and Border Protection officer may issue you this form. It allows you temporary admittance to the United States for 30 days. During that time you must send the required documents to the Student and Exchange Visitor Program (SEVP) Form I-515A processing team or depart the United States. To learn more, visit Form I-515A Overview This is very important: If you do not send the required documents to the SEVP Form I-515A processing team within 30 days, your nonimmigrant status will be terminated, and you must leave the United States immediately. Form I-539, “Application to Extend/Change Nonimmigrant Status” Use this form if you want to request a change to another nonimmigrant visa status (F-2 to F-1, F-1 to H-1B, etc.), or to request reinstatement if you have fallen out of student status. M students must also use this form to extend nonimmigrant status or transfer to another Student and Exchange Visitor Program-certified school. You can complete this form on the I-539, Application To Extend/Change Nonimmigrant Status page of the U.S. Citizenship and Immigration Services website. For more information about applications to extend or change nonimmigrant status, please visit the Change of Status resource page . To access a link to the online form and online filing eligibility, visit the Form I-539 Online page . Form I-765, “Application for Employment Authorization” Submit this form with U.S. Citizenship and Immigration Services (USCIS) to apply for employment authorization, such as optional practical training or off-campus employment. You can complete this form on the I-765, Application for Employment Authorization page of the USCIS website. For more information about instances when you may need to apply for employment authorization, visit the Training Opportunities in the United States resource page.",student forms forms united states form i-94 arrival departure record form i-94 arrival departure record department homeland security dhs document issued nonimmigrant aliens time lawful entry united states air sea port entry form i-94 evidence nonimmigrant s term admission used document legal status united states including length stay departure march 27 2013 u s customs border protection cbp published interim final rule definition form i-94 include electronic format federal register automate form i-94 new automated form i-94 process cbp officer create electronic automated arrival form i-94 admissions process nonimmigrants entering united states air sea port information already available various law enforcement databases new form i-94 automation process take effect april 30 2013 streamline admissions process individuals lawfully visiting united states air sea port information regarding form i-94 automation please review resources i-94 admission number retrieval stakeholder webinar form i-94 automation form i-94 fact sheet form i-94 quick reference guide find information viewers players page form i-515a notice student exchange visitor arrive u s port entry without required documents customs border protection officer may issue form allows temporary admittance united states 30 days time must send required documents student exchange visitor program sevp form i-515a processing team depart united states learn visit form i-515a overview important send required documents sevp form i-515a processing team within 30 days nonimmigrant status terminated must leave united states immediately form i-539 application extend change nonimmigrant status use form want request change another nonimmigrant visa status f-2 f-1 f-1 h-1b etc request reinstatement fallen student status students must also use form extend nonimmigrant status transfer another student exchange visitor program-certified school complete form i-539 application extend change nonimmigrant status page u s citizenship immigration services website information applications extend change nonimmigrant status please visit change status resource page access link online form online filing eligibility visit form i-539 online page form i-765 application employment authorization submit form u s citizenship immigration services uscis apply employment authorization optional practical training off-campus employment complete form i-765 application employment authorization page uscis website information instances may need apply employment authorization visit training opportunities united states resource page
prepare,Student Forms,"Form I-766, “Employment Authorization Document”","When U.S. Citizenship and Immigration Services approves your Form I-765, you will receive a Form I-766, ""Employment Authorization Document"" (EAD) in the mail. This is your proof that you have authorization to work in the United States. You must carry this card with you when you travel. You may not begin to work until the date listed on your EAD; it also lists the date when your employment authorization ends. For more information about instances when you may need to apply for an EAD, visit the Working in the United States resource page . Form I-797A, “Notice of Action” This form is a notice of approval of an application or of receipt of a submission. You may receive this form while in F or M status in any of these situations: If U.S. Citizenship and Immigration Services approves your Form I-539 request to change your nonimmigrant status (e.g., to F-1 from another status or from F-1 to H-1B status). To notify you of approval of your application for reinstatement of student status or extension of status When you have submitted a I-901 SEVIS Fee payment, to notify you that the Student and Exchange Visitor Program has received it and that the transaction is complete As a receipt for a filed Form I-290B, “Notice of Appeal or Motion,” or employment authorization","Student Forms
Form I-766, “Employment Authorization Document”
When U.S. Citizenship and Immigration Services approves your Form I-765, you will receive a Form I-766, ""Employment Authorization Document"" (EAD) in the mail. This is your proof that you have authorization to work in the United States. You must carry this card with you when you travel. You may not begin to work until the date listed on your EAD; it also lists the date when your employment authorization ends. For more information about instances when you may need to apply for an EAD, visit the Working in the United States resource page . Form I-797A, “Notice of Action” This form is a notice of approval of an application or of receipt of a submission. You may receive this form while in F or M status in any of these situations: If U.S. Citizenship and Immigration Services approves your Form I-539 request to change your nonimmigrant status (e.g., to F-1 from another status or from F-1 to H-1B status). To notify you of approval of your application for reinstatement of student status or extension of status When you have submitted a I-901 SEVIS Fee payment, to notify you that the Student and Exchange Visitor Program has received it and that the transaction is complete As a receipt for a filed Form I-290B, “Notice of Appeal or Motion,” or employment authorization",student forms form i-766 employment authorization document u s citizenship immigration services approves form i-765 receive form i-766 employment authorization document ead mail proof authorization work united states must carry card travel may begin work date listed ead also lists date employment authorization ends information instances may need apply ead visit working united states resource page form i-797a notice action form notice approval application receipt submission may receive form f status situations u s citizenship immigration services approves form i-539 request change nonimmigrant status e g f-1 another status f-1 h-1b status notify approval application reinstatement student status extension status submitted i-901 sevis fee payment notify student exchange visitor program received transaction complete receipt filed form i-290b notice appeal motion employment authorization
prepare,Students and the Form I-20,,"All F and M students that study in the United States need a Form I-20, “Certificate of Eligibility for Nonimmigrant Student Status.” Once accepted into a Student and Exchange Visitor Program (SEVP)-certified school , nonimmigrant students will receive a Form I-20 from their designated school official (DSO) . You must also obtain a Form I-20 for any eligible dependents you plan to bring to the United States with you. However, please note that the name (i.e., Academic and Language students vs. Vocational Students) on the Form I-20 an SEVP-certified school issues you will dictate the type of student visa you may obtain from the U.S. Department of State and the status you will need to maintain in the United States. You and your DSO must both sign the Form I-20. If you are under age 18, your parents must sign the Form I-20 for you.","Students and the Form I-20
All F and M students that study in the United States need a Form I-20, “Certificate of Eligibility for Nonimmigrant Student Status.” Once accepted into a Student and Exchange Visitor Program (SEVP)-certified school , nonimmigrant students will receive a Form I-20 from their designated school official (DSO) . You must also obtain a Form I-20 for any eligible dependents you plan to bring to the United States with you. However, please note that the name (i.e., Academic and Language students vs. Vocational Students) on the Form I-20 an SEVP-certified school issues you will dictate the type of student visa you may obtain from the U.S. Department of State and the status you will need to maintain in the United States. You and your DSO must both sign the Form I-20. If you are under age 18, your parents must sign the Form I-20 for you.",students form i-20 f students study united states need form i-20 certificate eligibility nonimmigrant student status accepted student exchange visitor program sevp -certified school nonimmigrant students receive form i-20 designated school official dso must also obtain form i-20 eligible dependents plan bring united states however please note name e academic language students vs vocational students form i-20 sevp-certified school issues dictate type student visa may obtain u s department state status need maintain united states dso must sign form i-20 age 18 parents must sign form i-20
prepare,Students and the Form I-20,Form I-20 Uses,"The Form I-20 is an important document that you should keep safe, as you will need it throughout the F and M student life cycle. Before you pay the I-901 Student and Exchange Visitor Information System (SEVIS) Fee, you must receive the Form I-20 from a DSO at the school you plan to attend. You will need information from the Form I-20 to pay the fee. The I-901 SEVIS Fee is mandatory and must be paid before you enter the United States. In order to pay the I-901 SEVIS fee, all prospective F and M students will need to provide their: Name, address, date of birth and email address. Country of birth and country of citizenship. School Code as listed on the Form I-20 “Certificate of Eligibility for Nonimmigrant Student Status.” SEVIS Identification Number as listed on the Form I-20. The Form I-20 lists your program start date, 30 days before which you are allowed to enter the United States. F-1 and M-1 student visas can be issued up to 365 days in advance of your course of study start date. Your type of student visa must match the type of Form I-20 you have (e.g., F-1 or M-1). You are expected to have the original Form I-20 at your visa interview. The consular officer may accept a copy of the Form I-20 in limited circumstances that warrant visa issuance prior to you receiving the original Form I-20. You are expected to have the signed Form I-20 on hand as you enter the country. Do not pack it away in your suitcase. A U.S. Customs and Border Protection officer will instruct you to present your Form I-20 at the port of entry . You may arrive up to 30 days before the start date listed on your Form I-20; or You need a Form I-20 if you are already in the United States as another type of nonimmigrant and you are applying to USCIS to change your status to F or M. Your Form I-20 proves that you are legally enrolled in a program of study in the United States. Therefore, it may be needed when you apply for the benefits available to F and M students. If you are eligible to apply for a driver’s license or a social security number , remember to bring your Form I-20 with you.","Students and the Form I-20
Form I-20 Uses
The Form I-20 is an important document that you should keep safe, as you will need it throughout the F and M student life cycle. Before you pay the I-901 Student and Exchange Visitor Information System (SEVIS) Fee, you must receive the Form I-20 from a DSO at the school you plan to attend. You will need information from the Form I-20 to pay the fee. The I-901 SEVIS Fee is mandatory and must be paid before you enter the United States. In order to pay the I-901 SEVIS fee, all prospective F and M students will need to provide their: Name, address, date of birth and email address. Country of birth and country of citizenship. School Code as listed on the Form I-20 “Certificate of Eligibility for Nonimmigrant Student Status.” SEVIS Identification Number as listed on the Form I-20. The Form I-20 lists your program start date, 30 days before which you are allowed to enter the United States. F-1 and M-1 student visas can be issued up to 365 days in advance of your course of study start date. Your type of student visa must match the type of Form I-20 you have (e.g., F-1 or M-1). You are expected to have the original Form I-20 at your visa interview. The consular officer may accept a copy of the Form I-20 in limited circumstances that warrant visa issuance prior to you receiving the original Form I-20. You are expected to have the signed Form I-20 on hand as you enter the country. Do not pack it away in your suitcase. A U.S. Customs and Border Protection officer will instruct you to present your Form I-20 at the port of entry . You may arrive up to 30 days before the start date listed on your Form I-20; or You need a Form I-20 if you are already in the United States as another type of nonimmigrant and you are applying to USCIS to change your status to F or M. Your Form I-20 proves that you are legally enrolled in a program of study in the United States. Therefore, it may be needed when you apply for the benefits available to F and M students. If you are eligible to apply for a driver’s license or a social security number , remember to bring your Form I-20 with you.",students form i-20 form i-20 uses form i-20 important document keep safe need throughout f student life cycle pay i-901 student exchange visitor information system sevis fee must receive form i-20 dso school plan attend need information form i-20 pay fee i-901 sevis fee mandatory must paid enter united states order pay i-901 sevis fee prospective f students need provide name address date birth email address country birth country citizenship school code listed form i-20 certificate eligibility nonimmigrant student status sevis identification number listed form i-20 form i-20 lists program start date 30 days allowed enter united states f-1 m-1 student visas issued 365 days advance course study start date type student visa must match type form i-20 e g f-1 m-1 expected original form i-20 visa interview consular officer may accept copy form i-20 limited circumstances warrant visa issuance prior receiving original form i-20 expected signed form i-20 hand enter country pack away suitcase u s customs border protection officer instruct present form i-20 port entry may arrive 30 days start date listed form i-20 need form i-20 already united states another type nonimmigrant applying uscis change status f form i-20 proves legally enrolled program study united states therefore may needed apply benefits available f students eligible apply driver s license social security number remember bring form i-20
prepare,Students and the Form I-20,When to Get a New Form I-20,"After receiving the initial Form I-20 upon program acceptance, students may receive a new Form I-20 from their DSO in the following circumstances: If the physical copy of the form is destroyed or misplaced. For travel endorsement. When the student’s SEVIS status changes (e.g., from Initial to Active). For any substantive change to student information, such as changes to a student’s personal information, program of study, optional practical training, etc.","Students and the Form I-20
When to Get a New Form I-20
After receiving the initial Form I-20 upon program acceptance, students may receive a new Form I-20 from their DSO in the following circumstances: If the physical copy of the form is destroyed or misplaced. For travel endorsement. When the student’s SEVIS status changes (e.g., from Initial to Active). For any substantive change to student information, such as changes to a student’s personal information, program of study, optional practical training, etc.",students form i-20 get new form i-20 receiving initial form i-20 upon program acceptance students may receive new form i-20 dso following circumstances physical copy form destroyed misplaced travel endorsement student s sevis status changes e g initial active substantive change student information changes student s personal information program study optional practical training etc
prepare,Students and the Form I-20,Redesigned Form I-20,"As of July 1, 2016, the redesigned Form I-20 is required for all F and M nonimmigrant visa applications, entry into the United States, travel and applications for nonimmigrant benefits. The previous version of the Form I-20 (with a barcode) is now invalid. Students please note that your DSOs were responsible for providing an updated, hard copy of the Form I-20 with original signatures to all F-1 and M-1 students at their schools.","Students and the Form I-20
Redesigned Form I-20
As of July 1, 2016, the redesigned Form I-20 is required for all F and M nonimmigrant visa applications, entry into the United States, travel and applications for nonimmigrant benefits. The previous version of the Form I-20 (with a barcode) is now invalid. Students please note that your DSOs were responsible for providing an updated, hard copy of the Form I-20 with original signatures to all F-1 and M-1 students at their schools.",students form i-20 redesigned form i-20 july 1 2016 redesigned form i-20 required f nonimmigrant visa applications entry united states travel applications nonimmigrant benefits previous version form i-20 barcode invalid students please note dsos responsible providing updated hard copy form i-20 original signatures f-1 m-1 students schools
