topic,title,section,text,raw_document,cleaned_document
get-started,Kindergarten to Grade 12 Students,Special notes for minor children of F-1 and M-1 students,"A minor F-2 or M-2 dependent of an F-1 or M-1 student may attend public K-12 school at the appropriate grade level without any additional permission or documentation from SEVP. State education laws may require that F-2 and M-2 students attend the appropriate grade level until a certain age. The elementary or secondary school an F-2 or M-2 student attends does not need to be SEVP-certified. For a minor F-2 or M-2 dependent to transfer from a public school to a private school, the F-1 or M-1 student and/or F-2 spouse, if applicable, should talk to the school’s DSO. If you are an F-2 or M-2 dependent who wants to continue studying in the United States, you can learn more on the Change of Status page.","Kindergarten to Grade 12 Students
Special notes for minor children of F-1 and M-1 students
A minor F-2 or M-2 dependent of an F-1 or M-1 student may attend public K-12 school at the appropriate grade level without any additional permission or documentation from SEVP. State education laws may require that F-2 and M-2 students attend the appropriate grade level until a certain age. The elementary or secondary school an F-2 or M-2 student attends does not need to be SEVP-certified. For a minor F-2 or M-2 dependent to transfer from a public school to a private school, the F-1 or M-1 student and/or F-2 spouse, if applicable, should talk to the school’s DSO. If you are an F-2 or M-2 dependent who wants to continue studying in the United States, you can learn more on the Change of Status page.",kindergarten grade 12 students special notes minor children f-1 m-1 students minor f-2 m-2 dependent f-1 m-1 student may attend public k-12 school appropriate grade level without additional permission documentation sevp state education laws may require f-2 m-2 students attend appropriate grade level certain age elementary secondary school f-2 m-2 student attends need sevp-certified minor f-2 m-2 dependent transfer public school private school f-1 m-1 student f-2 spouse applicable talk school s dso f-2 m-2 dependent wants continue studying united states learn change status page
get-started,Programs of Study,,"The United States offers an unparalleled variety of program options for F or M students. All programs of study F and M students attend must be certified by the Student and Exchange Visitor Program (SEVP). To find an SEVP-certified school or program, visit the Study in the States school search page . Below are examples of programs offered to eligible F or M students in the United States.","Programs of Study
The United States offers an unparalleled variety of program options for F or M students. All programs of study F and M students attend must be certified by the Student and Exchange Visitor Program (SEVP). To find an SEVP-certified school or program, visit the Study in the States school search page . Below are examples of programs offered to eligible F or M students in the United States.",programs study united states offers unparalleled variety program options f students programs study f students attend must certified student exchange visitor program sevp find sevp-certified school program visit study states school search page examples programs offered eligible f students united states
get-started,Programs of Study,K-12 Schools,"In the United States, students usually begin a formal educational program around age five or six in kindergarten. Children then complete grade levels one to 12 before attending college or university. There are two types of kindergarten through grade 12 (K-12) schools in the United States: public and private. Laws regarding ages for compulsory education vary by state. These laws apply to both public and private K-12 schools. To learn more about attending a K-12 school, visit the Kindergarten to Grade 12 page .","Programs of Study
K-12 Schools
In the United States, students usually begin a formal educational program around age five or six in kindergarten. Children then complete grade levels one to 12 before attending college or university. There are two types of kindergarten through grade 12 (K-12) schools in the United States: public and private. Laws regarding ages for compulsory education vary by state. These laws apply to both public and private K-12 schools. To learn more about attending a K-12 school, visit the Kindergarten to Grade 12 page .",programs study k-12 schools united states students usually begin formal educational program around age five six kindergarten children complete grade levels one 12 attending college university two types kindergarten grade 12 k-12 schools united states public private laws regarding ages compulsory education vary state laws apply public private k-12 schools learn attending k-12 school visit kindergarten grade 12 page
get-started,Programs of Study,Community Colleges,"Community colleges, sometimes called junior colleges, are two-year schools that can provide affordable postsecondary education as a pathway to a four-year degree. For more information about community colleges, visit our What is a Community College? blog post .","Programs of Study
Community Colleges
Community colleges, sometimes called junior colleges, are two-year schools that can provide affordable postsecondary education as a pathway to a four-year degree. For more information about community colleges, visit our What is a Community College? blog post .",programs study community colleges community colleges sometimes called junior colleges two-year schools provide affordable postsecondary education pathway four-year degree information community colleges visit community college blog post
get-started,Programs of Study,STEM,"When researching programs of study in the United States, you will likely see opportunities referred to as STEM programs. STEM is an acronym for the fields of science, technology, engineering and math. There are many Student and Exchange Visitor Program-certified schools that offer undergraduate and graduate opportunities to study in STEM programs. To find out more about STEM, visit the What is STEM? blog post .","Programs of Study
STEM
When researching programs of study in the United States, you will likely see opportunities referred to as STEM programs. STEM is an acronym for the fields of science, technology, engineering and math. There are many Student and Exchange Visitor Program-certified schools that offer undergraduate and graduate opportunities to study in STEM programs. To find out more about STEM, visit the What is STEM? blog post .",programs study stem researching programs study united states likely see opportunities referred stem programs stem acronym fields science technology engineering math many student exchange visitor program-certified schools offer undergraduate graduate opportunities study stem programs find stem visit stem blog post
get-started,Programs of Study,Undergraduate and Graduate Schools,"An international student may enroll in an undergraduate program to earn an associate’s or bachelor’s degree. When enrolled in graduate school, a student earns a master’s and/or doctorate degree. Remember that each program is different, so you should do your research to make sure the one you select matches your interests and goals. For more information about the difference between a undergraduate and graduate program, visit our Graduate School in the United States blog post .","Programs of Study
Undergraduate and Graduate Schools
An international student may enroll in an undergraduate program to earn an associate’s or bachelor’s degree. When enrolled in graduate school, a student earns a master’s and/or doctorate degree. Remember that each program is different, so you should do your research to make sure the one you select matches your interests and goals. For more information about the difference between a undergraduate and graduate program, visit our Graduate School in the United States blog post .",programs study undergraduate graduate schools international student may enroll undergraduate program earn associate s bachelor s degree enrolled graduate school student earns master s doctorate degree remember program different research make sure one select matches interests goals information difference undergraduate graduate program visit graduate school united states blog post
get-started,Programs of Study,English Language Training,"English language training programs are for international students who want to pursue an English language training course of study. The Student and Exchange Visitor Program (SEVP) defines two types of English language training: A “stand-alone” English language training program is an SEVP-certified institution whose officials have indicated on the school's Form I-17, “Petition for Approval of School for Attendance by Nonimmigrant Student,” that the school offers only English language training programs of study. A “combined” English language training program is an SEVP-certified institution whose officials have indicated on the school's Form I-17 that the school offers an English language training program of study, as well as other programs of study. To learn more, please visit the English Language Training Note: “English language training program” is the term used in 8 CFR 214. SEVP uses this term as synonymous with English as a second language (ESL), English speakers of other languages (ESOL), Intensive English Program (IEP), etc.","Programs of Study
English Language Training
English language training programs are for international students who want to pursue an English language training course of study. The Student and Exchange Visitor Program (SEVP) defines two types of English language training: A “stand-alone” English language training program is an SEVP-certified institution whose officials have indicated on the school's Form I-17, “Petition for Approval of School for Attendance by Nonimmigrant Student,” that the school offers only English language training programs of study. A “combined” English language training program is an SEVP-certified institution whose officials have indicated on the school's Form I-17 that the school offers an English language training program of study, as well as other programs of study. To learn more, please visit the English Language Training Note: “English language training program” is the term used in 8 CFR 214. SEVP uses this term as synonymous with English as a second language (ESL), English speakers of other languages (ESOL), Intensive English Program (IEP), etc.",programs study english language training english language training programs international students want pursue english language training course study student exchange visitor program sevp defines two types english language training stand-alone english language training program sevp-certified institution whose officials indicated school s form i-17 petition approval school attendance nonimmigrant student school offers english language training programs study combined english language training program sevp-certified institution whose officials indicated school s form i-17 school offers english language training program study well programs study learn please visit english language training note english language training program term used 8 cfr 214 sevp uses term synonymous english second language esl english speakers languages esol intensive english program iep etc
get-started,What is a Commission-Based Recruiter?,,"As you begin your journey of preparing to study in the United States, you may be considering the option of consulting service providers to help you in this process. Depending on where you live, such services could include a recruiter, broker or agent who charges fees or receives a commission for such things as helping you obtain a student visa, housing or other services. A recruiter is often known as Zhongjie in China and Yeo Haeng Saa in Korea. You do not need to use a recruiter in order to obtain a United States student visa. Free information about applying for an F or M visa is available from the Department of State's website. It is important to know your rights and responsibilities and the problems you could encounter by hiring an agent or recruiter. You must ensure that your living arrangements in the United States are adequate for your needs. The arrangements a recruiter makes for you may not match how the recruiter describes them to you. A recruiter cannot prevent you from moving to a new living arrangement. Also, the fees paid for your housing should not be tied to the agent or recruiter. You must ensure that the school where you enroll meets your educational objectives. If it does not, a recruiter cannot prevent you from transferring to another school. Be aware that the U.S. government cannot force recruiters to refund fees you have paid to them for not meeting your expectations (such as bad living arrangements or the school program not providing what you expected).","What is a Commission-Based Recruiter?
As you begin your journey of preparing to study in the United States, you may be considering the option of consulting service providers to help you in this process. Depending on where you live, such services could include a recruiter, broker or agent who charges fees or receives a commission for such things as helping you obtain a student visa, housing or other services. A recruiter is often known as Zhongjie in China and Yeo Haeng Saa in Korea. You do not need to use a recruiter in order to obtain a United States student visa. Free information about applying for an F or M visa is available from the Department of State's website. It is important to know your rights and responsibilities and the problems you could encounter by hiring an agent or recruiter. You must ensure that your living arrangements in the United States are adequate for your needs. The arrangements a recruiter makes for you may not match how the recruiter describes them to you. A recruiter cannot prevent you from moving to a new living arrangement. Also, the fees paid for your housing should not be tied to the agent or recruiter. You must ensure that the school where you enroll meets your educational objectives. If it does not, a recruiter cannot prevent you from transferring to another school. Be aware that the U.S. government cannot force recruiters to refund fees you have paid to them for not meeting your expectations (such as bad living arrangements or the school program not providing what you expected).",commission-based recruiter begin journey preparing study united states may considering option consulting service providers help process depending live services could include recruiter broker agent charges fees receives commission things helping obtain student visa housing services recruiter often known zhongjie china yeo haeng saa korea need use recruiter order obtain united states student visa free information applying f visa available department state s website important know rights responsibilities problems could encounter hiring agent recruiter must ensure living arrangements united states adequate needs arrangements recruiter makes may match recruiter describes recruiter cannot prevent moving new living arrangement also fees paid housing tied agent recruiter must ensure school enroll meets educational objectives recruiter cannot prevent transferring another school aware u s government cannot force recruiters refund fees paid meeting expectations bad living arrangements school program providing expected
get-started,What is a Commission-Based Recruiter?,What if I choose to use a recruiter?,"If you choose to use a recruiter, the following information comes from students who had successful experiences with their recruiters: Look for a recruiter with a legitimate reputation in your home community. Ask peers, current teachers or other people who have used the recruiter about their experience. Be wary of recruiters that do not detail what services will be provided for a particular fee or who do not provide sufficient detail about their background, training or experience in the industry when you ask them. Be wary of any recruiter who promises that you can work without restrictions while attending school. The designated school official (DSO) at your Student and Exchange Visitor Program (SEVP)-certified school can authorize some types of employment for you and must do so before you can begin. For other types of employment, you need your DSO’s recommendation and authorization from U.S. Citizenship and Immigration Services (USCIS). There is no employment that you can legally do in the United States without coordinating with your DSO. Any work pursued outside of this process may be grounds for termination from the school. Do your own research on the schools with which the recruiter partners and determine how the academic community, both in your country and in the United States, perceives the school. Before you work with the recruiter, determine for yourself if the school is right for you. EducationUSA has more than 400 advising centers in 170 countries around the world. These advisors can help you choose a school and a program of study. There are no fees for receiving their services. Verify that the schools with which the recruiter partners are SEVP-certified. An F or M student may only attend an SEVP-certified school. You can use the Study in the States school search page to make sure the school in which you are interested is SEVP-certified. A recruiter should not offer to write an admissions essay or significantly alter an admissions essay for you on the presumption that a school’s admissions department can be “fooled.” Make sure that the school’s credits will transfer to other schools in the United States. You can ask the DSO to identify schools that accept their credits and then contact those schools to confirm this agreement between the schools.","What is a Commission-Based Recruiter?
What if I choose to use a recruiter?
If you choose to use a recruiter, the following information comes from students who had successful experiences with their recruiters: Look for a recruiter with a legitimate reputation in your home community. Ask peers, current teachers or other people who have used the recruiter about their experience. Be wary of recruiters that do not detail what services will be provided for a particular fee or who do not provide sufficient detail about their background, training or experience in the industry when you ask them. Be wary of any recruiter who promises that you can work without restrictions while attending school. The designated school official (DSO) at your Student and Exchange Visitor Program (SEVP)-certified school can authorize some types of employment for you and must do so before you can begin. For other types of employment, you need your DSO’s recommendation and authorization from U.S. Citizenship and Immigration Services (USCIS). There is no employment that you can legally do in the United States without coordinating with your DSO. Any work pursued outside of this process may be grounds for termination from the school. Do your own research on the schools with which the recruiter partners and determine how the academic community, both in your country and in the United States, perceives the school. Before you work with the recruiter, determine for yourself if the school is right for you. EducationUSA has more than 400 advising centers in 170 countries around the world. These advisors can help you choose a school and a program of study. There are no fees for receiving their services. Verify that the schools with which the recruiter partners are SEVP-certified. An F or M student may only attend an SEVP-certified school. You can use the Study in the States school search page to make sure the school in which you are interested is SEVP-certified. A recruiter should not offer to write an admissions essay or significantly alter an admissions essay for you on the presumption that a school’s admissions department can be “fooled.” Make sure that the school’s credits will transfer to other schools in the United States. You can ask the DSO to identify schools that accept their credits and then contact those schools to confirm this agreement between the schools.",commission-based recruiter choose use recruiter choose use recruiter following information comes students successful experiences recruiters look recruiter legitimate reputation home community ask peers current teachers people used recruiter experience wary recruiters detail services provided particular fee provide sufficient detail background training experience industry ask wary recruiter promises work without restrictions attending school designated school official dso student exchange visitor program sevp -certified school authorize types employment must begin types employment need dso s recommendation authorization u s citizenship immigration services uscis employment legally united states without coordinating dso work pursued outside process may grounds termination school research schools recruiter partners determine academic community country united states perceives school work recruiter determine school right educationusa 400 advising centers 170 countries around world advisors help choose school program study fees receiving services verify schools recruiter partners sevp-certified f student may attend sevp-certified school use study states school search page make sure school interested sevp-certified recruiter offer write admissions essay significantly alter admissions essay presumption school s admissions department fooled make sure school s credits transfer schools united states ask dso identify schools accept credits contact schools confirm agreement schools
